subreddit_name,post_created_utc,id,is_original_content,is_self,link_flair_text,locked,num_comments,over_18,score,spoiler,stickied,title,upvote_ratio,url
pics,1641359961.0,rwf14a,False,False,,False,8,False,50,False,False,My son's checking on the sheep.,0.87,https://i.redd.it/fgsiru7c0t981.jpg
pics,1641394349.0,rwoo8g,False,False,,False,24,False,46,False,False,"US Capitol on January 6, 2021",0.75,https://i.redd.it/n0d9lhnluv981.jpg
pics,1641350672.0,rwbzwa,False,False,,False,14,False,47,False,False,Forest fairy 😍😍,0.7,https://www.reddit.com/gallery/rwbzwa
pics,1641348951.0,rwbe77,False,False,,False,1,False,50,False,False,"Mountain bois in Quilotoa, Ecuador",0.94,https://www.reddit.com/gallery/rwbe77
pics,1641346920.0,rwaoo5,True,False,,False,10,False,46,False,False,"""Crash and Wake"" 2022. Finally captured the relation between sea and land at this spot.",0.91,https://i.imgur.com/FM6NJbb.jpeg
pics,1641349825.0,rwbp2d,False,False,,False,12,False,47,False,False,2 face of New York,0.9,https://www.reddit.com/gallery/rwbp2d
pics,1641414909.0,rww9tg,False,False,Arts/Crafts,False,3,False,48,False,False,My first ink drawing of 2022.,0.82,https://i.redd.it/ng8vhu0qjx981.jpg
pics,1641381600.0,rwkne3,False,False,,False,6,False,46,False,False,When you only bought one bushel of corn but you went to CVS,0.82,https://i.redd.it/875spmfosu981.jpg
pics,1641353015.0,rwcst5,False,False,,False,3,False,44,False,False,"It might be flat here, but the skies are always dancing in Saskatchewan!",0.88,https://i.redd.it/zv0n3itmfs981.jpg
pics,1641384036.0,rwlbk7,False,False,,False,6,False,44,False,False,Flight to Miami,0.89,https://i.redd.it/0mxue0lxzu981.jpg
pics,1641378117.0,rwjqit,False,False,,False,1,False,42,False,False,"Sunset in North Queensland, 🇦🇺",0.92,https://i.redd.it/nul3gzobiu981.jpg
pics,1641399026.0,rwqd3r,False,False,,False,2,False,41,False,False,Turned out better than expected,0.9,https://i.redd.it/nuk97och8w981.jpg
pics,1641346408.0,rwaigd,False,False,,False,5,False,35,False,False,Antique chess set feautring Spaniards vs Incas,0.89,https://www.reddit.com/gallery/rwaigd
pics,1641397889.0,rwpxdn,False,False,,False,2,False,38,False,False,We got a new puppy for Christmas. We think she’s the cutest.,0.8,https://i.redd.it/qhvdc8f45w981.jpg
pics,1641354432.0,rwd9jk,False,False,,False,3,False,46,False,False,Feeling Frost,0.93,https://i.redd.it/024lad7wjs981.jpg
pics,1641381577.0,rwkn7p,False,False,,False,8,False,51,False,False,Taken on my new IPhone 13 Pro with night time mode in almost pitch black darkness!,0.79,https://i.redd.it/lkw6br2msu981.jpg
pics,1641347734.0,rwayrm,False,False,,False,11,False,51,False,False,I’ve been collecting playing cards for a while now. Here’s what I’ve gathered so far.,0.84,https://www.reddit.com/gallery/rwayrm
pics,1641349938.0,rwbql9,False,False,,False,3,False,52,False,False,Death Valley,0.91,https://i.redd.it/45h89w9j6s981.jpg
pics,1641352829.0,rwcqjq,False,False,,False,2,False,81,False,False,"The Thaw - where there is light, there is hope",0.91,https://i.redd.it/ulp9adk3fs981.jpg
pics,1641343329.0,rw9g0n,False,False,,False,3,False,79,False,False,Grocery store in Alaska after 80 mph winds for 3 straight days,0.95,https://imgur.com/O5f6Ddd
pics,1641396000.0,rwp972,False,False,,False,5,False,78,False,False,"Constantine, Algeria",0.97,https://i.redd.it/5igpia9izv981.jpg
pics,1641417466.0,rwx35v,False,False,,False,8,False,93,False,False,The sky in Japan,0.92,https://i.redd.it/451qhbxbrx981.jpg
pics,1641398377.0,rwq3v0,False,False,,False,16,False,74,False,False,A photo I took of my favourite street.,0.94,https://i.redd.it/vyjnl9pk6w981.jpg
pics,1641420150.0,rwxyra,False,False,Arts/Crafts,False,11,False,108,False,False,My most detailed piece. Playing cards cut by hand into 3D art.,0.97,https://i.redd.it/zm3q4m9bzx981.jpg
pics,1641341469.0,rw8t3a,False,False,,False,1,False,66,False,False,Our cat having a stand-off with our next door neighbour,0.96,https://i.redd.it/z7pdbnqchr981.jpg
pics,1641410182.0,rwunbv,False,False,,False,5,False,65,False,False,From this angle this is the sassiest sign guy I’ve ever seen,0.97,https://i.redd.it/kg75uz9l5x981.jpg
pics,1641351178.0,rwc68t,False,False,,False,8,False,56,False,False,My husband works at a landfill and took this picture of a bald eagle flying away,0.88,https://i.redd.it/zqcazn58as981.jpg
pics,1641390179.0,rwn78a,False,False,,False,4,False,61,False,False,A pic I took a few years ago… simply stunning!,0.91,https://i.redd.it/qd50pr57iv981.jpg
pics,1641357034.0,rwe3y2,False,False,,False,1,False,59,False,False,Got out of class during sunset,0.93,https://i.redd.it/0z5lyu2nrs981.jpg
pics,1641402563.0,rwrp1s,False,False,Arts/Crafts,False,5,False,59,False,False,Theodore Ushev drew the eyes of the doctors and nurses who are treating him for Covid-19.,0.9,https://i.redd.it/ng357vu9iw981.jpg
pics,1641358305.0,rweidw,False,False,,False,2,False,57,False,False,The Illusion of an Explosion,0.91,https://imgur.com/wAjO4uz.jpg
pics,1641387792.0,rwmfza,False,False,,False,10,False,55,False,False,Peppers at local farmers market,0.92,https://i.redd.it/81vggzh3bv981.jpg
pics,1641347516.0,rwaw0n,False,False,,False,8,False,59,False,False,Absolute unit. Staring a brown bear like that is as close as it gets to staring death in the eyes.,0.95,https://i.redd.it/gk64s41pw4181.jpg
pics,1641412733.0,rwvjx2,False,False,,False,4,False,60,False,False,"The King Elvis Presley signing autographs for fans, circa 1950s",0.94,https://i.redd.it/4jev13c9dx981.jpg
pics,1641400449.0,rwqwek,False,False,,False,17,False,51,False,False,"Liz Hurley's iconic Safety Pin dress, 1994 which made her famous overnight",0.81,https://www.reddit.com/gallery/rwqwek
pics,1641361123.0,rwfdmg,False,False,Arts/Crafts,False,6,False,53,False,False,I painted my gloves - Anishinaabe style,0.9,https://i.redd.it/rlsbnt6r3t981.jpg
pics,1641353280.0,rwcw19,False,False,,False,1,False,50,False,False,I love watching the skies in northern Saskatchewan where there is no light pollution!,0.9,https://i.redd.it/dkt12y7egs981.jpg
pics,1641339178.0,rw80sb,False,False,,False,6,False,53,False,False,"The mothman statue in Point pleasant, West Virginia",0.89,https://i.redd.it/0a8il1c9ar981.jpg
pics,1641415777.0,rwwja9,False,False,,False,2,False,64,False,False,First big snowfall of the new year,0.98,https://i.redd.it/oaq0e7tamx981.jpg
pics,1641403051.0,rwrvmr,True,False,,False,3,False,42,False,False,Crying of Tree!,0.82,https://i.redd.it/7rkwb59dkw981.jpg
pics,1641387125.0,rwm8dt,False,False,Arts/Crafts,False,9,False,39,False,False,Mummified head with Moko facial tattoo,0.9,https://i.redd.it/brd3ye449v981.jpg
