subreddit_name,post_created_utc,id,is_original_content,is_self,link_flair_text,locked,num_comments,over_18,score,spoiler,stickied,title,upvote_ratio,url
funny,1641419708.0,rwxtb7,False,False,,False,3,False,21,False,False,I’m unwilling to make any sacrifices,0.92,https://v.redd.it/03bvev20yx981
funny,1641414431.0,rww4a1,False,False,,False,48,False,118,False,False,We're saved!,0.83,https://i.redd.it/2cfv0sfaix981.jpg
funny,1641420963.0,rwyagc,False,False,,False,9,False,177,False,False,He understood the assignment 🐳,0.96,https://v.redd.it/96dbgugq1y981
funny,1641383208.0,rwl358,False,False,,False,9,False,87,False,False,Apple M67 (credit: Kommander Karl on YouTube),0.8,https://v.redd.it/cpg67qf2xu981
funny,1641357462.0,rwe8vi,False,False,,False,7,False,84,False,False,So sometimes people buy an action figure and return it with a cheaper different one just to keep the original one. This is the most ridiculous figure swap I’ve ever seen.,0.9,https://i.redd.it/heu3ojnwss981.jpg
funny,1641414504.0,rww544,False,False,,False,8,False,84,False,False,Classic Aussie pandemic humour,0.92,https://i.redd.it/m82rybziix981.jpg
funny,1641409483.0,rwudfg,False,False,,False,11,False,93,False,False,Classic British humour,0.96,https://v.redd.it/mtth36wy2x981
funny,1641406941.0,rwtdfd,False,False,,False,16,False,87,False,False,Went to fix a slot machine in a betting shop the other day and seen this in the the toilet. Hung around for a few hours incase they were stuck in traffic.,0.94,https://i.redd.it/kpbvxv9fuw981.jpg
funny,1641385347.0,rwlpas,False,False,,False,9,False,75,False,False,The Christmas tree at my chemo center,0.86,https://i.redd.it/93tc0xxm3v981.jpg
funny,1641345528.0,rwa7q3,False,False,,False,8,False,79,False,False,The Wikipedia page for Technophobia (fear of advanced technology) has an image of a computer with the Technophobia page opened,0.94,https://i.redd.it/103eahhftr981.jpg
funny,1641352104.0,rwchli,False,False,,False,7,False,74,False,False,Damn even nature is segregated,0.77,https://i.redd.it/33wq8yczcs981.jpg
funny,1641370511.0,rwhup5,False,False,,False,12,False,93,False,False,kitty,0.8,https://i.redd.it/v1nbgcsnvt981.jpg
funny,1641355449.0,rwdlkg,False,False,,False,20,False,70,False,False,Worst stand up comedian ever. After 13 years still cannot tell if he’s trolling,0.87,https://v.redd.it/qs0zqs0xms981
funny,1641348286.0,rwb5w1,False,False,,False,14,False,64,False,False,Tequila - Cures whatever ails you,0.86,https://v.redd.it/bt5m9jjm1s981
funny,1641419446.0,rwxq5s,False,False,,False,17,False,80,False,False,Well said Amazon…,0.97,https://i.redd.it/pny787u7xx981.jpg
funny,1641376146.0,rwj87d,False,False,,False,4,False,56,False,False,The Largest instrument being played by a professional.,0.74,https://v.redd.it/aa9qtomdcu981
funny,1641418136.0,rwxash,False,False,,False,6,False,63,False,False,This guy gets it,0.9,https://i.redd.it/vzechnubtx981.jpg
funny,1641394259.0,rwon2u,False,False,,False,4,False,51,False,False,"My daughter got some magnet letters for Christmas. Needless to say, my husband's been having a ball with them.",0.75,https://i.redd.it/vsew1twbuv981.jpg
funny,1641414076.0,rww0be,False,False,,False,4,False,53,False,False,"I need your clothes, your boots and your mobility scooter",0.81,https://i.redd.it/cia40na9hx981.jpg
funny,1641420830.0,rwy8iz,False,False,,False,8,False,69,False,False,The moment we all been waiting for! 🌰,0.84,https://v.redd.it/iqufizga1y981
funny,1641344931.0,rwa0ed,False,False,,False,18,False,47,False,False,I wonder what the fox said?,0.8,https://i.redd.it/zqhbepcnrr981.jpg
funny,1641373268.0,rwiico,False,False,,False,12,False,43,False,False,This is shadow and she spites every single one of u,0.77,https://imgur.com/76rsnGL.jpg
funny,1641369856.0,rwhowz,False,False,,False,6,False,45,False,False,This is the best thing I have ever seen,0.73,https://v.redd.it/v2oe1i1rtt981
funny,1641368366.0,rwhbbh,False,False,,False,7,False,72,False,False,"2010's: ""So how's the decade been going""",0.8,https://i.redd.it/abv0ekoyot981.png
funny,1641345436.0,rwa6nn,False,False,,False,25,False,45,False,False,"No one is safe in Florida, reason number 1 why I don't touch that state",0.71,https://v.redd.it/pzagiksysr981
funny,1641361304.0,rwffjy,False,False,,False,8,False,94,False,False,Nothing beats Reddit,0.82,https://v.redd.it/his8wkpb4t981
funny,1641411680.0,rwv6w9,False,False,,False,22,False,121,False,False,Mmmm,0.94,https://i.redd.it/an1aiz22ax981.jpg
funny,1641370900.0,rwhxub,False,False,,False,7,False,14,False,False,"Sign at someone's local coffee shop, top dollar!",0.77,https://imgur.com/RcVuK43
funny,1641357283.0,rwe6rr,False,False,,False,240,False,13426,False,False,Kid thought he was at the ceiling!,0.94,https://v.redd.it/0ztrwed4ss981
funny,1641346198.0,rwaftq,False,False,,False,101,False,1814,False,False,A friend of mine got this as a wedding present....,0.95,https://i.redd.it/q20x118fvr981.jpg
funny,1641396324.0,rwpd9y,False,False,,False,50,False,989,False,False,Nutella prank,0.87,https://v.redd.it/0cfsooqa0w981
funny,1641337748.0,rw7i2n,False,False,,False,62,False,577,False,False,I see your well hung giraffe with my daughters unicorn!,0.94,https://i.redd.it/fls3i4ja6r981.jpg
funny,1641407097.0,rwtfnr,False,False,,False,17,False,418,False,False,Happy New Year,0.84,https://i.redd.it/7uhkiochww981.jpg
funny,1641404716.0,rwsi2l,False,False,,False,106,False,452,False,False,The actual seal of St Francois County in Missouri,0.93,https://i.redd.it/jz1337gdpw981.png
funny,1641412017.0,rwva84,False,False,,False,25,False,523,False,False,Liam Neeson Season!,0.94,https://v.redd.it/384qay14bx981
funny,1641375689.0,rwj4a2,False,False,,False,15,False,340,False,False,"Ah yes, the 3 genders. Male, Female and shared parental leave for UK",0.93,https://i.redd.it/efkgcjt3bu981.jpg
funny,1641404941.0,rwsl4v,False,False,,False,47,False,361,False,False,Dropping my very dry christmas tree out of a 6 story window,0.83,https://v.redd.it/lxmchd3zpw981
funny,1641371403.0,rwi1zq,False,False,,False,3,False,98,False,False,gotta do with what you have,0.84,https://v.redd.it/8uq6rfecyt981
funny,1641378490.0,rwjtqf,False,False,,False,30,False,290,False,False,Construction site toilet poetry. Share yours best poem!,0.88,https://i.redd.it/25c9r54aju981.jpg
funny,1641346318.0,rwahbs,False,False,,False,31,False,197,False,False,Got some water at the right time,0.83,https://i.redd.it/7obwnckrvr981.jpg
funny,1641413065.0,rwvokd,False,False,,False,22,False,193,False,False,The new year is going pretty well,0.89,https://v.redd.it/0oskcn78ex981
funny,1641381416.0,rwklqs,False,False,,False,4,False,131,False,False,Lè artistè,0.9,https://img.izismile.com/img/img14/20220105/gifs/morning_gifdump_193_14.gif
funny,1641417988.0,rwx95h,False,False,,False,27,False,168,False,False,Must be a german cat?,0.94,https://v.redd.it/70ej5l6vsx981
funny,1641412217.0,rwvcrm,False,False,,False,10,False,139,False,False,My humor is broken.,0.79,https://v.redd.it/g18i0owpbx981
funny,1641412483.0,rwvggu,False,False,,False,8,False,118,False,False,Does Snoop know about this?,0.94,https://i.redd.it/nj3ndeqicx981.jpg
funny,1641339081.0,rw7zis,False,False,,False,22,False,108,False,False,Let my 2 year old pick his dinner tonight. That used to be a chocolate doughnut.,0.86,https://i.redd.it/dvk53a19ar981.jpg
funny,1641356432.0,rwdx2p,False,False,,False,14,False,106,False,False,Thanks,0.9,https://v.redd.it/rfq1rjptps981
funny,1641405177.0,rwsodx,False,False,,False,12,False,108,False,False,"Stay right here, let me call my husband.",0.84,https://v.redd.it/s5yuy1vpqw981
funny,1641356948.0,rwe2wk,False,False,,False,13,False,103,False,False,"Needless to say, I bought the helmet",0.88,https://i.redd.it/ym8t6podrs981.png
funny,1641409429.0,rwucly,False,False,,False,19,False,297,False,False,Bachelor used billboard to find a wife to ‘save me from an arranged marriage’,0.95,https://i.redd.it/cpajhitf3x981.jpg
funny,1641408056.0,rwtt4g,False,False,,False,8,False,50,False,False,Pingu roasts franklin🥶🥶,0.88,https://v.redd.it/1k94m0obzw981
funny,1641343226.0,rw9epb,False,False,,False,19,False,44,False,False,Revolutionary medical treatment for coughing and complete media silence. Why hasn't the CDC been looking into this??,0.86,https://i.redd.it/cbcdj81lmr981.jpg
funny,1641338275.0,rw7osw,False,False,,False,9,False,22,False,False,How was it to live before 1999?,0.8,https://i.redd.it/157xyuyu7r981.png
funny,1641418341.0,rwxd7i,False,False,,False,9,False,26,False,False,"Nice try, Coppers!",0.88,https://i.redd.it/6dko1omxtx981.jpg
funny,1641416755.0,rwwuwr,False,False,,False,1,False,20,False,False,"Thank you for the laughs, Chrome Developer Tools",0.81,https://i.redd.it/xt4pqt12px981.png
funny,1641410921.0,rwuvz8,False,False,,False,4,False,23,False,False,In the name of Timmy’s!,0.96,https://i.redd.it/8wxrpdcv7x981.jpg
funny,1641408096.0,rwttq9,False,False,,False,6,False,21,False,False,Didn’t even have mu audio on and I knew this was russian😂,0.75,https://v.redd.it/z4yz860hzw981
funny,1641415906.0,rwwkrl,False,False,,False,22,False,489,False,False,The only response when a restaurant sings you happy birthday.,0.91,https://v.redd.it/4ojiuqibmx981
funny,1641376591.0,rwjc8q,False,False,,False,158,False,5295,False,False,just two arabs casually fighting over the bill,0.96,https://v.redd.it/e71855nrdu981
funny,1641405053.0,rwsmph,False,False,,False,125,False,1614,False,False,"My GF: ""I couldn't fit it in freezer."" I hereby apologize to the whole French nation",0.96,https://imgur.com/GIhkp0y
funny,1641416326.0,rwwpmn,False,False,,False,60,False,1089,False,False,I mailed my sister one square of toilet paper and it was delivered.,0.97,https://i.redd.it/yar9kl4dnx981.png
funny,1641394173.0,rwolzs,False,False,,False,90,False,5522,False,False,Dog jumpscare,0.95,https://v.redd.it/l8v8g5s2uv981
funny,1641410815.0,rwuujj,False,False,,False,83,False,2405,False,False,My pizza never arrived and they asked for photographic proof.,0.97,https://i.redd.it/shv2b28k7x981.jpg
funny,1641338251.0,rw7ohz,False,False,,False,12,False,39,False,False,This Mural in a Restaurant Near a Naval Base.,0.83,https://i.redd.it/u1vpuexr7r981.jpg
funny,1641405302.0,rwsq0k,False,False,,False,254,False,5414,False,False,floridians as soon as it reaches 60 degrees,0.96,https://i.redd.it/j9tvxw06rw981.jpg
funny,1641380014.0,rwk89i,False,False,,False,1,False,9,False,True,"Subreddit Of The Month [January 2022]: /r/PeopleLookingUp. Know of a small (under 20,000 subscribers) humor-based subreddit that deserves a month in the spotlight? Link it inside!",0.76,https://www.reddit.com/r/PeopleLookingUp/
funny,1623683699.0,nzp2n0,False,True,,False,880,False,2493,False,True,ANNOUNCEMENT: We're making some changes to how comics are handled.,0.98,https://www.reddit.com/r/funny/comments/nzp2n0/announcement_were_making_some_changes_to_how/
funny,1641389612.0,rwn0nw,False,False,,False,15,False,25,False,False,My family did a prom style Christmas photo,0.63,https://i.redd.it/1jsdnk2hgv981.jpg
funny,1641340230.0,rw8dcm,False,False,,False,25,False,17,False,False,"Porn man. (my girlfriend's 9yo always puts a circle, not a dot, at the top of the letter 'i')",0.66,https://i.redd.it/j3p9llaodr981.jpg
funny,1641422377.0,rwyuez,False,False,,False,5,False,35,False,False,Novax Djokovic,0.87,https://i.redd.it/xt7w7hvx5y981.jpg
funny,1641416312.0,rwwpgn,False,False,,False,5,False,20,False,False,For all the non well-smelling ones,0.96,https://i.redd.it/0c4em8hwnx981.jpg
funny,1641412886.0,rwvm6e,False,False,,False,6,False,23,False,False,Ho Ho…hold on a second.,0.96,https://i.redd.it/i9gnfispdx981.jpg
funny,1641391398.0,rwnm6n,False,False,,False,7,False,21,False,False,Why you need a pet playpen...,0.79,https://i.redd.it/1jtctv7tlv981.jpg
funny,1641394751.0,rwotbi,False,False,,False,6,False,19,False,False,Where has my country gone? -Mr Garrison,0.7,https://i.redd.it/yyejyuosvv981.jpg
funny,1641419444.0,rwxq4j,False,False,,False,3,False,18,False,False,French Bulldog Sounds Like a Car on a Racetrack,0.95,https://www.youtube.com/watch?v=WZPzn-Cdmcg
funny,1641405220.0,rwsoza,False,False,,False,2350,False,43370,False,False,Today I fucked up,0.88,https://i.redd.it/r8ki9s9xqw981.jpg
funny,1641404216.0,rwsb8f,False,False,,False,11,True,17,False,False,This potato looks suspiciously peachy.,0.75,https://i.redd.it/bbt9n3iunw981.jpg
funny,1641366419.0,rwgtos,False,False,,False,6,False,21,False,False,"Not the business combination we wanted, but the one we deserve?...🤔",0.84,https://i.redd.it/zsh8r45jjt981.jpg
funny,1641412132.0,rwvbkz,False,False,,False,4,False,26,False,False,My dogs make for some good backup sirens,1.0,https://v.redd.it/8ujn1hegbx981
funny,1641421055.0,rwybp2,False,False,,False,8,False,66,False,False,In terms everyone can understand,0.72,https://i.redd.it/hzz7apc02y981.jpg
funny,1641354817.0,rwde5b,False,False,,False,15,False,40,False,False,Thank god I found this- I can finally stop using that box.,0.82,https://i.redd.it/lx8e08vuks981.jpg
funny,1641364849.0,rwgf6m,False,False,,False,7,False,36,False,False,"What are they gonna do, send him to me?",0.79,https://i.redd.it/knj93hpvet981.jpg
funny,1641357278.0,rwe6pa,False,False,,False,6,False,37,False,False,from the same toy set from post about the giraffe,0.86,https://i.redd.it/bzg41qadss981.jpg
funny,1641353282.0,rwcw1x,False,False,,False,10,False,38,False,False,This cat hates Steven Seagal,0.7,https://i.redd.it/bwcr465hgs981.jpg
funny,1641421866.0,rwyn8v,False,False,,False,14,False,82,False,False,My Body Trying To Not Get Omicron 🦠,0.87,https://v.redd.it/ljxays654y981
funny,1641408561.0,rwu04s,False,False,,False,4,False,39,False,False,he may seem chill right now but I dare you to move that sock,0.9,https://i.redd.it/qnroi1tu0x981.jpg
funny,1641410784.0,rwuu4d,False,False,,False,1,False,37,False,False,Found this on TikTok today,0.77,https://v.redd.it/f4yae7pg7x981
funny,1641355019.0,rwdgeq,False,False,,False,18,False,34,False,False,Browsing apple store and this was the first review for the 13,0.78,https://i.redd.it/x7bzdaanls981.jpg
funny,1641404369.0,rwsda7,False,False,,False,5,False,32,False,False,Oh Shit It's the Squirtle Squad,0.81,https://v.redd.it/1yjupfwcow981
funny,1641399428.0,rwqin9,False,False,,False,6,False,26,False,False,"""I'm Spartacus"", one of the funniest advertisements ever released.",0.87,https://www.youtube.com/watch?v=oo44zWHMvIY
funny,1641402146.0,rwrjbc,False,False,,False,31,False,31,False,False,New blender was stronger than expected,0.71,https://v.redd.it/o0sb6f5phw981
funny,1641349144.0,rwbgkg,False,False,,False,21,True,32,False,False,Browsing Etsy for a personalized 'dog mom' gift. One of these breeds does not photograph well from behind.,0.77,https://i.redd.it/9ca15zz54s981.jpg
funny,1641413026.0,rwvo3m,False,False,,False,4,True,32,False,False,If Nintendo were an Australian company...,0.76,https://i.redd.it/l7o9fyy4ex981.jpg
funny,1641387351.0,rwmatl,False,False,,False,10,False,28,False,False,I think my freezer got a boner,0.63,https://i.redd.it/hvzgqejc9v981.jpg
funny,1641406324.0,rwt4kt,False,False,,False,6,False,30,False,False,The robots are taking our jobs!,0.78,https://i.redd.it/9ymvytz4uw981.jpg
funny,1641389787.0,rwn2m7,False,False,,False,14,False,30,False,False,Good News! We are all going to get Pie!,0.76,https://i.redd.it/p3gwwca1hv981.jpg
funny,1641338877.0,rw7wuc,False,False,,False,12,False,24,False,False,Probably not the best sign to display during a pandemic,0.75,https://i.redd.it/lblknl6m9r981.jpg
funny,1641417247.0,rwx0m2,False,False,,False,5,False,28,False,False,Choices,0.91,https://i.redd.it/8pnqfn2gqx981.jpg
funny,1641341987.0,rw8zh8,False,False,,False,3,False,28,False,False,Existential Bop-it,0.79,https://i.redd.it/v0n76rhwir981.jpg
funny,1641356430.0,rwdx28,False,False,,False,2,False,24,False,False,First snow,0.75,https://i.redd.it/mpvndplups981.jpg
funny,1641422762.0,rwyzpj,False,False,,False,21,False,184,False,False,Home Testing,0.83,https://i.redd.it/14tct2537y981.jpg
funny,1641383526.0,rwl6bv,False,False,,False,2,True,33,False,False,My suggestive 2FA code this morning,0.83,https://i.redd.it/ubjep9zeyu981.jpg
pics,1641346974.0,rwapam,False,False,,False,1,False,37,False,False,Meet Pigeon (Pidge) the cat,0.83,https://i.redd.it/dcj6w9tpxr981.jpg
pics,1641367650.0,rwh4pj,False,False,,False,5,False,34,False,False,Picture of my beautiful girl. 💛,0.85,https://i.redd.it/irtd2hl7nt981.jpg
pics,1641341695.0,rw8vxp,False,False,Arts/Crafts,False,4,False,40,False,False,First new painting of the new year.,0.91,https://i.redd.it/86ejqo41ir981.jpg
pics,1641393251.0,rwoauy,False,False,,False,74,False,33,False,False,An unvaxxed patient on a rotoprone bed and hypothermic protocol,0.64,https://i.imgur.com/SHIO985.jpg
pics,1639583560.0,rh25ex,False,True,Politics,False,246,False,156,False,True,Some Clarifications About Abortion-Centric Debates,0.87,https://www.reddit.com/r/pics/comments/rh25ex/some_clarifications_about_abortioncentric_debates/
pics,1641388183.0,rwmk7l,False,False,,False,3,False,36,False,False,This picture I took at the Tomb of the Unknown Soldier.,0.89,https://i.redd.it/rmheu799cv981.jpg
pics,1641370414.0,rwhtt3,False,False,,False,31,False,332,False,False,Orange County DeLorean Club @ Sonic,0.96,https://i.redd.it/6iweivffvt981.jpg
pics,1641351457.0,rwc9ho,False,False,,False,45,False,234,False,False,Lappet-faced Vultures,0.95,https://i.redd.it/b8p5hs62bs981.jpg
pics,1641395613.0,rwp4cl,False,False,,False,40,False,235,False,False,Product not as advertised,0.93,https://i.redd.it/121jfovcyv981.jpg
pics,1641357364.0,rwe7qg,False,False,,False,12,False,209,False,False,Went ice skating the other day,0.94,https://i.redd.it/5bttn0bmss981.jpg
pics,1641357387.0,rwe7zz,False,False,,False,9,False,194,False,False,Colours of the sky,0.93,https://imgur.com/WkpecVP.jpg
pics,1641397428.0,rwprf6,False,False,,False,32,False,186,False,False,"Lion Man is thought to be the worlds oldest discovered statue. Dating back about 40,000 years.",0.98,https://i.redd.it/ku504g3r3w981.jpg
pics,1641343869.0,rw9mrm,False,False,,False,15,False,165,False,False,I like making surreal renders. This is my first piece for 2022.,0.93,https://i.redd.it/xvbkbpuhor981.jpg
pics,1641357648.0,rweb0a,False,False,,False,15,False,148,False,False,Tesla's Lab,0.96,https://i.redd.it/frg5rc4ets981.jpg
pics,1641337487.0,rw7env,False,False,Arts/Crafts,False,11,False,142,False,False,Bonsai Forrest Made of Hanoki Cypress Trees Created By Bonsai Artist Masahiko Kimura,0.94,https://i.redd.it/w8f62yri5r981.jpg
pics,1641399429.0,rwqio4,False,False,,False,64,False,382,False,False,I hoped you might like one of my sculptures.,0.97,https://i.redd.it/y5olnk8p9w981.jpg
pics,1641399362.0,rwqhs4,False,False,Arts/Crafts,False,11,False,138,False,False,Just one of my simple jar paintings thought I’d share,0.95,https://i.redd.it/pzyhlh6i9w981.jpg
pics,1641399792.0,rwqnkh,False,False,Politics,False,4,False,117,False,False,The Statue of the (former) dictator of Kazakhstan has been demolished,0.98,https://i.redd.it/ox32hchlaw981.jpg
pics,1641341130.0,rw8ovh,False,False,,False,27,False,115,False,False,Yee Haw - Reddit's top ten thousand pictures,0.91,https://i.redd.it/mx2pkkvwfr981.png
pics,1641343903.0,rw9n6t,False,False,,False,12,False,97,False,False,A flock of cranes,0.93,https://i.imgur.com/3tbxdg1.jpg
pics,1641362258.0,rwfpd6,False,False,,False,60,False,91,False,False,I have also seen that truck from outside of Whole Foods,0.8,https://i.redd.it/cbk2wsa67t981.jpg
pics,1641395123.0,rwoya0,False,False,,False,9,False,91,False,False,when you're both hot garbage but you love each other anyway,0.83,https://i.redd.it/pguwtuluwv981.png
pics,1641344336.0,rw9snb,False,False,,False,7,False,88,False,False,"""Sun Dog"" in Montana - Refraction of light by atmospheric ice crystals at very cold temps.",0.97,https://i.redd.it/5qnniwuopr981.jpg
pics,1641352265.0,rwcjkm,False,False,Arts/Crafts,False,12,False,88,False,False,An oil painting I just finalized,0.91,https://i.redd.it/5lx4b50gds981.jpg
pics,1641390657.0,rwncu9,False,False,,False,21,False,89,False,False,Jumping stingray,0.94,https://i.redd.it/l8og3xcmjv981.jpg
pics,1641395705.0,rwp5if,False,False,,False,11,False,89,False,False,Local Chinese restaurant during lockdown,0.93,https://i.redd.it/usdft2omyv981.jpg
pics,1641342814.0,rw99mw,False,False,Arts/Crafts,False,9,False,124,False,False,The first drawing that I made in 2022,0.92,https://i.redd.it/hxk3q2sclr981.jpg
pics,1641359050.0,rweqz4,False,False,,False,5,False,86,False,False,Classic doge,0.83,https://i.redd.it/eqqkjlkmxs981.png
pics,1641398090.0,rwq00f,False,False,Arts/Crafts,False,22,False,511,False,False,Amazing sand art.,0.96,https://i.redd.it/j07hbl2p5w981.jpg
pics,1641354172.0,rwd6hq,False,False,,False,12,False,512,False,False,The cloud cover broke 2 minutes before sunset and gave me this.,0.97,https://imgur.com/Z6dEtI1.jpg
pics,1641390769.0,rwnea4,False,False,,False,2639,True,50848,False,False,An Iranian man smiles as he is about to be executed by hanging from a crane,0.91,https://i.redd.it/bgdjwycyjv981.jpg
pics,1641391652.0,rwnq1q,False,False,,False,2431,False,17305,False,False,My new neighbours flags. I live in switzerland.,0.95,https://i.redd.it/ux31m82hmv981.jpg
pics,1641389753.0,rwn28h,False,False,Politics,False,860,False,7745,False,False,A peaceful protestor looking to have his voice heard,0.9,https://i.redd.it/b542xanxgv981.jpg
pics,1641385187.0,rwlnhu,False,False,,False,788,False,5624,False,False,COVID patient receiving therapy in a rotoprone bed,0.95,https://i.redd.it/s8s6eahc3v981.jpg
pics,1641393962.0,rwojjh,False,False,,False,192,False,2638,False,False,There is a crashed B2 stealth bomber on google maps. Location: Whiteman Air Force Base,0.98,https://i.redd.it/454vm78ctv981.png
pics,1641405553.0,rwsth0,False,False,,False,30,False,1214,False,False,Brightened His Day,0.79,https://i.redd.it/fz8wzgzwrw981.jpg
pics,1641362876.0,rwfvzv,False,False,Picture of text,False,6815,False,43630,False,False,For The People Doubting The Authenticity of the Guy From Texas - My Son’s SCIENCE CLASS Homework,0.79,https://i.redd.it/5p59bjtz8t981.jpg
pics,1641418687.0,rwxh90,False,False,,False,49,False,357,False,False,Pyramids of Giza as seen from a nearby Pizza Hut a quarter mile away.,0.96,https://i.redd.it/92o9a52etx981.png
pics,1641381045.0,rwki61,False,False,,False,77,False,2221,False,False,Chadwick Boseman with his classmates at Howard University in the late 90s,0.94,https://www.reddit.com/gallery/rwki61
pics,1641340484.0,rw8gez,False,False,Arts/Crafts,False,38,False,453,False,False,Just finished another forest painting. Just sharing it with you,0.93,https://i.redd.it/mgciotreer981.jpg
pics,1641343332.0,rw9g1w,False,False,,False,9811,False,60735,False,False,My daughter has a project at her private school. The negatives of living in rural Texas.,0.56,https://i.redd.it/2l1plo7wmr981.jpg
pics,1641338962.0,rw7xyo,False,False,Arts/Crafts,False,169,False,7992,False,False,I thought you guys might like my acrylic painting I just finished! 😁,0.91,https://i.redd.it/6lhvfmiv9r981.png
pics,1641354245.0,rwd7cb,False,False,,False,60,False,4292,False,False,Mini Cheetah,0.95,https://i.redd.it/hzdkysgcjs981.jpg
pics,1641352828.0,rwcqj5,False,False,,False,260,False,3652,False,False,The chef’s knife I got for Christmas,0.96,https://i.redd.it/dzw54uh4fs981.jpg
pics,1641349013.0,rwbeya,False,False,,False,745,False,1633,False,False,A Message Outside of Whole Foods.,0.86,https://i.redd.it/rqqmohtr3s981.jpg
pics,1641351073.0,rwc4xz,False,False,,False,49,False,1201,False,False,Photo i took today that I’m extremely proud of,0.9,https://i.redd.it/pe9ny9vw9s981.jpg
pics,1641344740.0,rw9y0h,False,False,,False,39,False,1159,False,False,"Stoney 1st Nation Member Samson Beaver, wife Leah, and their daughter, 1907",0.97,https://i.redd.it/kknl3m03rr981.jpg
pics,1641384750.0,rwlj86,False,False,,False,60,False,974,False,False,Been hunting for the perfect venue for years. THIS is where I’m getting married.,0.9,https://i.redd.it/o8ghr6222v981.jpg
pics,1641373865.0,rwinn3,False,False,,False,34,False,558,False,False,Took a picture of the sunset on an half-empty plane on my way back home from Italy,0.94,https://i.redd.it/bk6zmwoo5u981.jpg
pics,1641391526.0,rwno0b,False,False,,False,62,False,581,False,False,This potassium ferrioxalate crystal I grew looks like a green rupee,0.97,https://i.redd.it/zls3vg1llv981.jpg
pics,1641347201.0,rwas1r,False,False,💩Shitpost💩,False,1387,False,27778,False,False,Still no one to celebrate with but I hit 500 days of drinking,0.68,https://i.imgur.com/xs9QZrt.jpg
pics,1641376195.0,rwj8kn,False,False,,False,33,False,84,False,False,guy,0.83,https://i.redd.it/rfavc48mcu981.jpg
pics,1641398650.0,rwq7zs,False,False,,False,9,False,83,False,False,"Rural property, fixer upper, no close neighbours",0.96,https://i.redd.it/l3rob3ud7w981.jpg
pics,1641389818.0,rwn2yt,False,False,,False,12,False,86,False,False,Random kid that wanted a pic w me after playing basketball w him for hours,0.73,https://i.redd.it/o9rmqdj4hv981.jpg
pics,1641346758.0,rwamns,True,False,,False,2,False,48,False,False,I made this collage out of my mom's old film photography,0.91,https://i.redd.it/26887fvxwr981.png
pics,1641363096.0,rwfy3r,False,False,,False,4,False,46,False,False,I appreciate this elevator sign.,0.91,https://i.redd.it/drc8e6zn9t981.jpg
pics,1641355471.0,rwdltp,True,False,,False,5,False,47,False,False,A exciting capture while traveling the Blue Ridge Parkway!,0.89,https://i.redd.it/5nysbegwms981.jpg
pics,1641352613.0,rwcnut,False,False,,False,6,False,50,False,False,Picture of one great Friend Shadow who is being missed.,0.85,https://i.redd.it/gw6rstmhes981.jpg
pics,1641406399.0,rwt5md,False,False,Arts/Crafts,False,9,False,54,False,False,This Margaery Tyrell cosplay by Xenia Shelkovskaya is scaringly accurate,0.78,https://i.redd.it/9mp3ndifuw981.jpg
pics,1641376247.0,rwj93k,False,False,,False,17,False,46,False,False,"Tables I made from curly Acacia aka ""Monkypod""",0.91,https://www.reddit.com/gallery/rwj93k
